Expansión - Economía,El peso mexicano se mantiene bajo las 20 unidades por dólar,"Tras la aprobación de la reforma judicial y la baja en la inflación en EU, la moneda se apreció 1.48% frente a las 20.09 unidades por dólar reportadas al cierre del martes.",Economía,https://expansion.mx/economia/2024/09/11/peso-mexicano-a-dolar-hoy-11-septiembre-cierre,"Wed, 11 Sep 2024 22:15:39 GMT"
Expansión - Economía,México va a facilitar y respaldar inversiones de EU: Marcelo Ebrard,"Luego de aprobada la reforma judicial, el próximo secretario de Economía revivió y posteó un video en redes sociales en el que dice que la integración de las dos economías avanza a paso acelerado.",Economía,https://expansion.mx/economia/2024/09/11/marcelo-ebrard-facilitara-y-respaldara-inversiones-eu,"Wed, 11 Sep 2024 16:14:02 GMT"
Expansión - Economía,La inversión extranjera cae en los estados más “atractivos” para el nearshoring,"La falta de energía eléctrica, escasez de agua y mano de obra, además de una infraestructura rebasada para el transporte le ponen freno a las decisiones de inversión.",Economía,https://expansion.mx/economia/2024/09/11/cae-inversion-extranjera-en-estados-norte-nearshoring,"Wed, 11 Sep 2024 11:05:52 GMT"
Expansión - Economía,"Comce espera inversiones por 48,000 mdd, pese a reforma judicial","El presidente del Consejo Empresarial Mexicano de Comercio Exterior destacó que prevén que la Inversión Extranjera Directa cierre 2024 en 40,000 millones de dólares, 11% más respecto a 2023.",Economía,https://expansion.mx/economia/2024/09/10/comce-inversiones-reforma-judicial,"Tue, 10 Sep 2024 21:41:50 GMT"
Expansión - Economía,"La inflación cede, pero Banxico enfrenta más retos para bajar tasa de interés",La volatilidad en el tipo de cambio generada por el avance de la reforma judicial representa un freno al banco central para  bajar la tasa de interés de referencia.,Economía,https://expansion.mx/economia/2024/09/10/inflacion-cede-banxico-enfrenta-retos-antes-de-bajar-tasas,"Tue, 10 Sep 2024 20:37:05 GMT"
Expansión - Economía,Los rendimientos de los Cetes tocan su nivel más bajo desde enero,Los rendimientos de los Cetes a 28 días tuvieron la tasa más baja desde enero pasado ante la expectativa de que Banxico haga más recortes a la tasa de referencia.,Economía,https://expansion.mx/economia/2024/09/10/cetes-rendimiento-bajo-28-dias-caen,"Tue, 10 Sep 2024 18:56:01 GMT"
Expansión - Economía,Mexico necesita una política industrial acorde a la economía actual: IMCO,"El centro de investigación apunta que en los últimos 20 años, el valor agregado a la producción de exportaciones manufactureras se ha estancado.",Economía,https://expansion.mx/economia/2024/09/10/mexico-politica-industrial-economia-imco,"Tue, 10 Sep 2024 18:28:03 GMT"
Expansión - Economía,¿Cuánto deben pagarte si trabajas el lunes 16 de septiembre?,"En el caso de que tu patrón no siga lo que marca la legislación mexicana, podrás denunciarlo ante la Profedet. Aprende a calcular cuánto deben pagarte y en dónde denunciar si no respetan tus derechos.",Economía,https://expansion.mx/economia/2024/09/10/cuanto-deben-pagarte-si-trabajas-el-lunes-16-de-septiembre,"Tue, 10 Sep 2024 16:38:29 GMT"
Expansión - Economía,Empresarios exigen a senadores de oposición mantenerse contra reforma judicial,"La Coparmex hace un llamado a los 43 senadores a resistir las ""presiones externas"".",Economía,https://expansion.mx/economia/2024/09/09/empresarios-senadores-oposicion-reforma-judicial,"Tue, 10 Sep 2024 01:30:18 GMT"
Expansión - Economía,La recaudación de impuestos sube 6% entre enero y agosto,"En los primeros ocho meses del 2024, la recaudación de impuestos por parte del Servicio de Administración Tributaria sumó 3.338 billones de pesos.",Economía,https://expansion.mx/economia/2024/09/09/recaudacion-de-impuestos-sube-entre-enero-y-agosto,"Mon, 09 Sep 2024 23:16:02 GMT"
Expansión - Economía,"La reforma judicial le pone cautela a las inversiones, advierte sector privado","La paulatina terminación de los proyectos del gobierno y la creciente incertidumbre política reciente, ha deteriorado rápidamente el dinamismo de la inversión, refiere el CEESP.",Economía,https://expansion.mx/economia/2024/09/09/reforma-judicial-cautela-inversiones-advierte-sector-privado,"Mon, 09 Sep 2024 20:46:22 GMT"
Expansión - Economía,La inflación se desacelera; subyacente toca su menor nivel desde febrero de 2021,"En agosto, la inflación general perdió ritmo al llegar a 4.99%, informó el Inegi.",Economía,https://expansion.mx/economia/2024/09/09/inflacion-agosto-2024-inegi,"Mon, 09 Sep 2024 12:49:14 GMT"
Expansión - Economía,Predomina el pago de deuda frente a la inversión en infraestructura,La actual administración rompió con una tendencia que predominaba desde 2007: mayor gasto para inversión física que para el pago de los intereses de la deuda.,Economía,https://expansion.mx/economia/2024/09/09/predomina-el-pago-de-deuda-frente-a-la-inversion-en-infraestructura,"Mon, 09 Sep 2024 11:05:33 GMT"
Expansión - Economía,Janet Yellen dice que su retiro puede llegar en enero,"La secretaria del Tesoro dijo que, en lo que termina la administración de Joe Biden, quiere tener otra reunión con el viceprimer ministro chino He Lifeng.",Economía,https://expansion.mx/economia/2024/09/07/yellen-puede-retirarse-servicio-publico-enero,"Sat, 07 Sep 2024 23:28:11 GMT"
Expansión - Tecnología,Amazon Prime y MGM Studios se unen a la MPA,Las empresas de entretenimiento se unen a otras como Netflix o Paramount Pictures.,Tecnología,https://expansion.mx/tecnologia/2024/09/19/amazon-prime-y-mgm-studios-se-unen-a-la-mpa,"Thu, 19 Sep 2024 23:00:37 GMT"
Expansión - Tecnología,Amazon lanza un nuevo bot que te ayudará a crecer las ventas,La empresa dio a conocer a Amelia para obtener los datos de venta e inventario de un negocio que está en la plataforma.,Tecnología,https://expansion.mx/tecnologia/2024/09/19/amazon-lanza-un-nuevo-bot-que-te-ayudara-a-crecer-las-ventas,"Thu, 19 Sep 2024 21:00:01 GMT"
Expansión - Tecnología,PlayStation lanza edición limitada con aspecto noventero,"Esta consola evoca al aspecto del primer equipo, lanzado por Sony en 1994, y forma parte de la celebración por sus 30 años.",Tecnología,https://expansion.mx/tecnologia/2024/09/19/playstation-lanza-edicion-limitada-30-aniversario,"Thu, 19 Sep 2024 19:00:05 GMT"
Expansión - Tecnología,Usuarios reportan que la alerta sísmica nunca llegó a sus celulares,El IFT había asegurado que hoy las empresas enviarían mensajes de emergencia por sismos pero nunca llegaron. Telcel asegura que las alertas dependen del regulador.,Tecnología,https://expansion.mx/tecnologia/2024/09/19/por-que-no-me-llego-mensaje-alerta-sismica-celular,"Thu, 19 Sep 2024 17:38:37 GMT"
Expansión - Tecnología,TelevisaUnivision nombra como nuevo CEO a un exdirectivo de Google,"Se trata de Daniel Alegre, en sustitución de Wade Davis,  quien cuenta con una amplia experiencia en empresas de tecnología y trabajando con la comunidad hispana en EU, México y América Latina.",Tecnología,https://expansion.mx/tecnologia/2024/09/19/televisaunivision-nuevo-ceo-exdirectivo-de-google,"Thu, 19 Sep 2024 15:58:28 GMT"
Expansión - Tecnología,Inversión en conectividad no caerá pese a política judicial: Neutral Networks,"El CEO de la compañía Neutral Networks, enfocada en infraestructura crítica, dijo que la necesidad de conectividad a nivel usuario como empresa será más fuerte que agendas políticas.",Tecnología,https://expansion.mx/tecnologia/2024/09/19/reforma-judicial-riesgo-confianza-invertir-telecomunicaciones,"Thu, 19 Sep 2024 15:42:38 GMT"
Expansión - Tecnología,Nintendo y The Pokémon Company demandan al creador de Palworld,"Las empresas japonesas iniciaron una acción legal en contra de Pocketpair, debido a infracciones de patentes al desarrollar el llamado “Pokémon con armas”.",Tecnología,https://expansion.mx/tecnologia/2024/09/19/nintendo-y-the-pokemon-company-demandan-al-creador-de-palworld,"Thu, 19 Sep 2024 15:00:36 GMT"
Expansión - Tecnología,TelevisaUnivisión sustituirá a Wade Davis como director general,La empresa decidió sustituir a Davis por Daniel Alegre debido a algunos de los resultados de la compañía que cayeron por debajo de las expectativas internas.,Tecnología,https://expansion.mx/tecnologia/2024/09/18/televisaunivision-sustituira-a-wade-davis-como-director-general,"Thu, 19 Sep 2024 00:51:13 GMT"
Expansión - Tecnología,YouTube presenta IA para hacer videos y ganar ‘más’ dinero,La empresa llevo a cabo Made on YouTube un evento donde también señaló que el número de creadores que obtienen la mayor parte de sus ingresos viene de TV.,Tecnología,https://expansion.mx/tecnologia/2024/09/18/youtube-presenta-ia-para-hacer-videos-y-ganar-mas-dinero,"Wed, 18 Sep 2024 21:00:56 GMT"
Expansión - Tecnología,La IA generativa transforma la operación y los ingresos empresariales,"El uso de IA generativa ha crecido en diversos sectores, impulsando la innovación y facilitando nuevas formas de operar en las organizaciones.",Tecnología,https://expansion.mx/tecnologia/2024/09/18/ia-generativa-transforma-operacion-e-ingresos-empresariales,"Wed, 18 Sep 2024 20:18:50 GMT"
Expansión - Tecnología,Amazon agrega a PayPal como método de pago en pedidos de Comprar con Prime,"Esta nueva opción estará disponible para los usuarios que realicen compras en sitios web de terceros, con membresía Prime.",Tecnología,https://expansion.mx/tecnologia/2024/09/18/amazon-agrega-a-paypal-como-metodo-de-pago-prime,"Wed, 18 Sep 2024 17:27:37 GMT"
Expansión - Tecnología,CFE Telecom perfila a nuevo CEO para impulsar el proyecto de internet,"Según dos fuentes con conocimiento del tema, al interior de la compañía se ha puesto sobre la mesa el nombre de Emiliano Calderón Mercado para ser el nuevo CEO de la estatal de telecomunicaciones.",Tecnología,https://expansion.mx/tecnologia/2024/09/18/nuevo-director-genera-general-de-cfe-telecom-quien-suena,"Wed, 18 Sep 2024 17:00:23 GMT"
Expansión - Tecnología,"Google se salva de una multa antimonopolio de 1,670 mmd",El caso comenzó por un supuesto dominio anticompetitivo de la empresa en el mercado de la publicidad en línea.,Tecnología,https://expansion.mx/tecnologia/2024/09/18/google-se-salva-de-una-multa-presunto-monopolio,"Wed, 18 Sep 2024 15:00:18 GMT"
Expansión - Tecnología,El e-commerce chino conquista las bolsas de valores,"Los dueños de Alibaba, Temu y JD conquistan el e-commerce del mundo, mientras diversifican sus negocios.",Tecnología,https://expansion.mx/tecnologia/2024/09/18/el-e-commerce-chino-conquista-las-bolsas-de-valores,"Wed, 18 Sep 2024 11:29:58 GMT"
Expansión - Tecnología,¿Cómo funciona el canje de teléfonos de Mercado Libre?,"Mercado Libre lanzó un nuevo programa llamado Trade in smartphones, con el que puedes canjear tu antiguo celular por un modelo nuevo.",Tecnología,https://expansion.mx/tecnologia/2024/09/17/canje-de-telefonos-mercado-libre,"Wed, 18 Sep 2024 01:24:09 GMT"
Expansión - Tecnología,Malware en Android permite retirar dinero desde cajeros automáticos,"NGate clona datos NFC de tarjetas de pago y los retransmite a un atacante, quien emula la tarjeta original para realizar retiros de dinero en cajeros automáticos.",Tecnología,https://expansion.mx/tecnologia/2024/09/17/malware-android-clona-tarjetas-retira-dinero-de-cajeros,"Wed, 18 Sep 2024 00:17:31 GMT"
Expansión - Tecnología,"Uber y Didi operan en los mismos sitios del AICM, pese a restricciones",Los usuarios continúan pidiendo el servicio de taxis por aplicación y Uber apunta que continuará operando con regularidad.,Tecnología,https://expansion.mx/tecnologia/2024/09/17/uber-didi-operan-aicm-pese-a-restricciones,"Tue, 17 Sep 2024 23:00:41 GMT"
Expansión - Tecnología,TikTok vs EU: una historia de antaño que no tiene fin claro,"Aunque la prohibición llegaría en enero de 2025, la empresa interpuso una demanda para evitar su restricción, mientras que los candidatos a la presidencia tampoco la quieren bloquear.",Tecnología,https://expansion.mx/tecnologia/2024/09/17/tiktok-vs-eu-una-historia-de-antano-que-no-tiene-fin-claro,"Tue, 17 Sep 2024 21:00:35 GMT"
Expansión - Tecnología,Cómo crear un diario personal con la IA de WhatsApp,"La inteligencia artificial de WhatsApp, Meta AI, puede aprovecharse para realizar y simplificar diferentes tareas. Aquí te explicamos cómo crear un diario personal",Tecnología,https://expansion.mx/tecnologia/2024/09/17/diario-personal-ia-whatsapp,"Tue, 17 Sep 2024 20:41:05 GMT"
Expansión - Tecnología,Alerta sísmica llegará a los teléfonos el próximo 19 de septiembre: IFT,"Telcel, AT&amp;T, Telefónica y Bait comenzarán a enviar notificaciones de emergencia  por sismos, huracanes o inundaciones en celulares.",Tecnología,https://expansion.mx/tecnologia/2024/09/17/ift-mensaje-celulares-simulacro-nacional,"Tue, 17 Sep 2024 19:05:31 GMT"
Expansión - Tecnología,"iOS 18, qué incluye esta nueva versión y cómo actualizar tu iPhone","Aunque todavía no se ha integrado Apple Intelligence, esta actualización al sistema operativo integra una serie de mejoras.",Tecnología,https://expansion.mx/tecnologia/2024/09/17/ios-18-que-incluye-esta-nueva-version-y-como-actualizar-tu-iphone,"Tue, 17 Sep 2024 19:00:57 GMT"
Expansión - Tecnología,Ahora los usuarios de Uber también deberán verificar su identidad,"Uber implementará una nueva verificación de identidad para los pasajeros, con el objetivo de ofrecer mayor seguridad a los conductores y evitar fraudes en la plataforma.",Tecnología,https://expansion.mx/tecnologia/2024/09/17/usuarios-de-uber-tambien-deberan-verificarse,"Tue, 17 Sep 2024 17:41:51 GMT"
Expansión - Tecnología,Intel y Amazon firman acuerdo comercial y el mercado lo recibe bien,Las empresas de tecnología trabajarán en conjunto una coinversión en diseños de chip personalizados para el negocio de nube de la big tech: AWS.,Tecnología,https://expansion.mx/tecnologia/2024/09/17/intel-amazon-acuerdo-comercial-mercado-recibe-bien,"Tue, 17 Sep 2024 17:00:15 GMT"
Expansión - Tecnología,OpenAI crea una junta de seguridad capaz de detener nuevos lanzamientos,"La empresa busca mejorar sus procesos de protección, confianza y transparencia en medio de la búsqueda de una nueva ronda de financiación multimillonaria.",Tecnología,https://expansion.mx/tecnologia/2024/09/17/openai-crea-una-junta-de-seguridad-capaz-de-detener-nuevos-lanzamientos,"Tue, 17 Sep 2024 15:10:26 GMT"
Expansión - Tecnología,Instagram lanza cuenta para adolescentes con controles parentales,Los usuarios menores de 16 años sólo podrán recibir mensajes y ser etiquetados por cuentas a las que sigan o con las que ya estén conectados.,Tecnología,https://expansion.mx/tecnologia/2024/09/17/instagram-lanza-cuenta-para-adolescentes,"Tue, 17 Sep 2024 14:10:35 GMT"
Expansión - Tecnología,¿El servicio al cliente en manos de la IA es mejor que los humanos?,Más de la mitad de los profesionales de servicio al cliente ya ocupan algún software impulsado por IA y se espera que continúe creciendo.,Tecnología,https://expansion.mx/tecnologia/2024/09/17/servicio-cliente-ia-es-mejor-que-los-humanos,"Tue, 17 Sep 2024 11:59:44 GMT"
Expansión - Tecnología,Intel aplaza el proyecto para instalar fábricas en Alemania y Polonia,"El anuncio se presenta después de que se revelara que la empresa recibirá hasta 3,000 millones de dólares del gobierno estadounidense para fabricar semiconductores.",Tecnología,https://expansion.mx/tecnologia/2024/09/16/intel-aplaza-el-proyecto-para-instalar-fabricas-en-alemania-y-polonia,"Tue, 17 Sep 2024 00:09:29 GMT"
Expansión - Tecnología,Amazon se despide del home office: sus empleados regresan a la oficina en 2025,"Las empresas han permitido que muchos empleados trabajen desde casa desde la pandemia, lo que ha dejado las oficinas casi vacías en varias ciudades como San Francisco y Seattle.",Tecnología,https://expansion.mx/tecnologia/2024/09/16/amazon-se-despide-del-home-office-sus-empleados-regresan-a-la-oficina-en-2025,"Mon, 16 Sep 2024 21:04:45 GMT"
Expansión - Tecnología,Rappi considera debutar en la Bolsa de Nueva York en un año,"Rappi opera en nueve países de la región y es considerada como un unicornio tecnológico con una valoración que supera los 5,000 millones de dólares.",Tecnología,https://expansion.mx/tecnologia/2024/09/16/rappi-considera-debutar-en-la-bolsa-de-nueva-york-en-un-ano,"Mon, 16 Sep 2024 20:00:43 GMT"
Expansión - Tecnología,TikTok y el Departamento de Justicia se enfrentan en los tribunales de EU,Los abogados de TikTok se enfrentarán al Departamento de Justicia en un tribunal de Washington sobre el destino de una ley que podría prohibir la aplicación de vídeos cortos.,Tecnología,https://expansion.mx/tecnologia/2024/09/16/tiktok-y-el-departamento-de-justicia-se-enfrentan-en-los-tribunales-de-eu,"Mon, 16 Sep 2024 17:44:38 GMT"
Expansión - Tecnología,¿Cómo beneficiaría a Altán Redes la desaparición del IFT?,"Con la eliminación del IFT, el Ejecutivo tendría la facultad para adjudicar directamente espectro a Altán para el plan de cierre de brecha digital y para volverse  más competitiva ante AT&amp;T y Telcel.",Tecnología,https://expansion.mx/tecnologia/2024/09/14/como-beneficiaria-a-altan-redes-la-desaparicion-del-ift,"Sat, 14 Sep 2024 16:58:53 GMT"
Expansión - Tecnología,Telefónica y Megacable aplican medidas de seguridad en Culiacán,Las compañías de telecomunicaciones decidieron modificar la operación de sus sucursales para garantizar la seguridad de sus trabajadores en la entidad que ha sido azotada por la violencia.,Tecnología,https://expansion.mx/tecnologia/2024/09/13/telefonica-y-megacable-aplican-medidas-de-seguridad-en-culiacan,"Sat, 14 Sep 2024 00:27:34 GMT"
Expansión - Tecnología,"Intel logra acuerdo de 3,500 mdd para fabricar chips para el ejército","Se trata de un programa secreto, llamado Secure Enclave, que busca establecer la producción de chips avanzados con aplicaciones militares y de Inteligencia.",Tecnología,https://expansion.mx/tecnologia/2024/09/13/intel-logra-acuerdo-de-3-500-mdd-para-fabricar-chips-para-el-ejercito,"Fri, 13 Sep 2024 23:52:53 GMT"
Expansión - Tecnología,Brasil desbloquea cuentas de Starlink y X tras transferencia de 3 mdd,El juez del Supremo Tribunal dijo que el levantamiento se ordenó porque la cantidad transferida a las arcas de Brasil alcanzaba el total que X debía al país en concepto de multas.,Tecnología,https://expansion.mx/tecnologia/2024/09/13/brasil-desbloquea-cuentas-starlink-x-transferencia-3-mdd,"Fri, 13 Sep 2024 22:30:59 GMT"
Expansión - Tecnología,¿Cuánto me da Apple por mi iPhone para abonar en la compra de uno nuevo?,"El programa Trade In recibe equipos desde el iPhone SE 2020 hasta el 15 Pro Max, con una bonificación máxima de 20,000 pesos.",Tecnología,https://expansion.mx/tecnologia/2024/09/13/cuanto-me-da-apple-por-mi-iphone-compra-nuevo,"Fri, 13 Sep 2024 21:15:09 GMT"
Expansión - Tecnología,Telmex suspende la atención de quejas y de Centros de servicios en Culiacán,"El Sindicato de Telefonistas dijo que debido a los enfrentamientos armados en la entidad, se decidió no abrir las tiendas, ni los centros de trabajo para resguardar la integridad de sus técnicos.",Tecnología,https://expansion.mx/tecnologia/2024/09/13/telmex-suspende-la-atencion-de-quejas-y-de-centros-de-servicios-en-culiacan,"Fri, 13 Sep 2024 17:20:31 GMT"
Expansión - Tecnología,¿Cómo usar las nuevas funciones de texto de Instagram?,"Las nuevas herramientas de texto incluyen más fuentes y efectos, así como la posibilidad de agregar texto superpuesto en publicaciones del feed.",Tecnología,https://expansion.mx/tecnologia/2024/09/13/nuevas-herramientas-de-texto-instagram,"Fri, 13 Sep 2024 15:30:44 GMT"
Expansión - Tecnología,Líderes tecnológicos  acudirán a la Casa Blanca para hablar de IA: CNN,Funcionarios de alto rango y líderes tecnológicos se darán cita para hablar de los recursos energéticos y la infraestructura necesarios para impulsar esta herramienta.,Tecnología,https://expansion.mx/tecnologia/2024/09/12/lideres-tecnologicos-casa-blanca-ia,"Thu, 12 Sep 2024 22:00:12 GMT"
Expansión - Tecnología,"OpenAI lanza una nueva serie de modelos de IA con capacidad de ""razonamiento""",El modelo conocido internamente como strawberry tuvo altas calificaciones en pruebas de matemáticas y codificación. Pero la empresa reconoce que aún puede dar respuestas limitadas.,Tecnología,https://expansion.mx/tecnologia/2024/09/12/openai-lanza-una-nueva-serie-de-modelos-de-ia-con-capacidad-de-razonamiento,"Thu, 12 Sep 2024 21:53:45 GMT"
Expansión - Tecnología,La UE ahora va por empresas de videojuegos,"Después de tener un foco en torno a las big tech, el organismo regulador busca esclarecer prácticas de compañías como Fortnite.",Tecnología,https://expansion.mx/tecnologia/2024/09/12/la-ue-ahora-va-por-empresas-de-videojuegos,"Thu, 12 Sep 2024 20:00:33 GMT"
Expansión - Tecnología,"La escritura manual de código tiene los días contados, vaticina el CEO de NVIDIA","Jensen Huang explicó que sus 32,000 ingenieros de software estarán acompañados de 100 veces más asistentes digitales, las 24 horas del día, los 7 días de la semana.",Tecnología,https://expansion.mx/tecnologia/2024/09/12/ceo-nvidia-vaticina-escritura-codigo-tiene-dias-contados,"Thu, 12 Sep 2024 19:34:15 GMT"
Expansión - Tecnología,"""Es precioso"", SpaceX logra la primera caminata espacial privada",Dos de los tripulantes de la misión Polaris Dawn lograron completar el hito de la primera caminata espacial privada de la historia.,Tecnología,https://expansion.mx/tecnologia/2024/09/12/spacex-primera-caminata-espacial-privada,"Thu, 12 Sep 2024 18:00:27 GMT"
Expansión - Tecnología,La reforma judicial amenaza inversiones y desarrollo de las telecomunicaciones,"La reforma plantea elegir jueces sin un perfil técnico, pero expertos aseguran que esto traerá problemas regulatorios e incluso el riesgo de contar con juzgadores con fines políticos.",Tecnología,https://expansion.mx/tecnologia/2024/09/12/telecomunicaciones-en-peligro-cambios-reforma-judicial,"Thu, 12 Sep 2024 15:14:47 GMT"
Expansión - Tecnología,La UE logra victoria judicial frente a Apple y Google,"La UE logró dos importantes victorias judiciales contra los gigantes tecnológicos Apple y Google, en batallas legales decididas por el máximo tribunal del bloque.",Tecnología,https://expansion.mx/tecnologia/2024/09/12/ue-victoria-judicial-frente-apple-y-google,"Thu, 12 Sep 2024 15:00:31 GMT"
Expansión - Tecnología,"Xbox anuncia nueva ronda de despidos, ahora serán 650 colaboradores","La tecnológica tuvo una reestructura tras la adquisición de Activision Blizzard, ahora hará un nuevo ajuste.",Tecnología,https://expansion.mx/tecnologia/2024/09/12/microsoft-despidos-masivos-650-trabajadores-de-xbox,"Thu, 12 Sep 2024 13:57:10 GMT"
Expansión - Tecnología,"Cómo borrar todas las publicaciones de tu perfil de Facebook, paso a paso",Muchas personas desean eliminar publicaciones antiguas de su perfil por diversas razones. Te mostramos cómo hacerlo de forma rápida.,Tecnología,https://expansion.mx/tecnologia/2024/09/11/como-borrar-todas-las-publicaciones-de-facebook,"Wed, 11 Sep 2024 23:37:21 GMT"
Expansión - Tecnología,IFT multa a Telcel con 90.6 mdp por evitar la venta de SIM de sus competidores,"El regulador detalló que la práctica anticompetitiva fue realizada con un distribuidor en estados de Michoacán, Colima y Jalisco y consistió en evitar la venta de SIM y recargas móviles.",Tecnología,https://expansion.mx/tecnologia/2024/09/11/practicas-monopolicas-telcel-ift-multa,"Wed, 11 Sep 2024 22:25:20 GMT"
